{"schema_version":"2.0.0","election_year":2012,"election_type":"presidential","unit":"national_age_band_sex","source_id":"ine_counted_lists","rate_unit":"proportion","data":[{"election_year":2012,"age_band":"101+","sex_code":"0","LN":4311,"SV":843,"NV":3459,"NS":9,"source_row_count":4243,"sex_2_source_rows":0,"sex_2_nominal_count":0,"national_specified_count":4302,"national_rate":0.19595536959553697},{"election_year":2012,"age_band":"101+","sex_code":"1","LN":6211,"SV":821,"NV":5374,"NS":16,"source_row_count":6075,"sex_2_source_rows":0,"sex_2_nominal_count":0,"national_specified_count":6195,"national_rate":0.13252623083131557},{"election_year":2012,"age_band":"18-34","sex_code":"0","LN":15889780,"SV":7760860,"NV":8092474,"NS":36446,"source_row_count":1094218,"sex_2_source_rows":0,"sex_2_nominal_count":0,"national_specified_count":15853334,"national_rate":0.4895411905155092},{"election_year":2012,"age_band":"18-34","sex_code":"1","LN":16493848,"SV":9827476,"NV":6629560,"NS":36812,"source_row_count":1093004,"sex_2_source_rows":0,"sex_2_nominal_count":0,"national_specified_count":16457036,"national_rate":0.5971595371122722},{"election_year":2012,"age_band":"35-59","sex_code":"0","LN":15744693,"SV":9830428,"NV":5880742,"NS":33523,"source_row_count":1587029,"sex_2_source_rows":0,"sex_2_nominal_count":0,"national_specified_count":15711170,"national_rate":0.6256967495100619},{"election_year":2012,"age_band":"35-59","sex_code":"1","LN":17213095,"SV":12314989,"NV":4861218,"NS":36888,"source_row_count":1586235,"sex_2_source_rows":0,"sex_2_nominal_count":0,"national_specified_count":17176207,"national_rate":0.7169795403606861},{"election_year":2012,"age_band":"60-100","sex_code":"0","LN":5182520,"SV":3634411,"NV":1536460,"NS":11649,"source_row_count":1576312,"sex_2_source_rows":0,"sex_2_nominal_count":0,"national_specified_count":5170871,"national_rate":0.7028624384557263},{"election_year":2012,"age_band":"60-100","sex_code":"1","LN":5956504,"SV":4013326,"NV":1929872,"NS":13306,"source_row_count":1657340,"sex_2_source_rows":0,"sex_2_nominal_count":0,"national_specified_count":5943198,"national_rate":0.6752805476108991}],"warnings":["Son segmentos agregados, no personas ni clases naturales descubiertas.","NS representa no especificación, no abstención. Las tasas no definidas son NULL.","Las claves territoriales se consultan dentro de cada elección; no hay equivalencias municipales históricas oficiales validadas.","U/R/M describe secciones electorales, no residencia individual ni localidad.","La lista nominal reportada procede de cuadernillos; no incluye casillas especiales ni voto del extranjero según el diccionario.","Los municipios pueden pertenecer a varios perfiles; su cobertura no se suma entre perfiles.","Los intervalos y el signo relativo son reglas explícitas. Una diferencia cercana a cero requiere cautela."]}